Question,Question Type (multiple-choice or multi-select),Answer Option 1,Answer Option 2,Answer Option 3,Answer Option 4,Answer Option 5,Answer Option 6,Answer Option 7,Answer Option 8,Answer Option 9,Answer Option 10,Answer Option 11,Answer Option 12,Answer Option 13,Answer Option 14,Answer Option 15,Correct Response,Explanation,Knowledge Area
"What is the first step in the vulnerability audit lifecycle?",multiple-choice,"Remediation","Reporting","Inventory and planification","Scanning",,,,,,,,,,,,3," The first step in the vulnerability audit lifecycle is the inventory of assets and defining the scope and timeline of the audit. It's crucial to know what systems, networks, and applications you're working with before you begin the vulnerability audit process.","Ethical Hacking, Reconnaissance, Scanning, Enumeration, Vulnerability Analysis"
"What is the role of CVSS in vulnerability analysis?",multiple-choice,"It assigns severity scores to vulnerabilities.","It lists all known system vulnerabilities.","It provides mitigation techniques for each known vulnerability.","It demonstrates how to exploit system vulnerabilities.",,,,,,,,,,,,1," CVSS (Common Vulnerability Scoring System) provides a way to capture the principal characteristics of a vulnerability and produce a numerical score reflecting its severity.","Ethical Hacking, Reconnaissance, Scanning, Enumeration, Vulnerability Analysis"
"What does the term 'passive reconnaissance' mean in the context of ethical hacking?",multiple-choice,"The attacker directly engages with the target system","The attacker uses brute force attacks","The attacker gathers information without directly interacting with the target","The attacker uses malware to compromise the target's system",,,,,,,,,,,,3," Passive reconnaissance involves collecting information about a target without direct engagement with the target system, thereby reducing the risk of detection.","Ethical Hacking, Reconnaissance, Scanning, Enumeration, Vulnerability Analysis"
"What does the 'Base Score' in CVSS represent?",multiple-choice,"It represents the intrinsic characteristics of a vulnerability that are constant over time and across user environments.","It represents the requirements for a successful exploit.","It represents the current threat and exposure landscape. ","It represents the potential impact on confidentiality, integrity, and availability.",,,,,,,,,,,,1," The 'Base Score' in CVSS represents the intrinsic characteristics of a vulnerability that are constant over time and across user environments. ","Ethical Hacking, Reconnaissance, Scanning, Enumeration, Vulnerability Analysis"
"Which of the following best describes 'active reconnaissance'?",multiple-choice,"The attacker gathers information about a target without interacting with the target","The attacker directly interacts with the target to gather information","The attacker uses a third-party to gather information about the target","The attacker only observes the target without collecting any information",,,,,,,,,,,,2," Active reconnaissance involves direct interaction with the target system or network, like sending packets and analyzing responses, to gather more detailed and specific information.","Ethical Hacking, Reconnaissance, Scanning, Enumeration, Vulnerability Analysis"
"What does the term 'traceroute' mean, and why is it useful in the footprinting process?",multiple-choice,"It's a technique to trace the path of network traffic; it helps understand how traffic flows through a network","It's a technique to track a user's behavior; it helps design targeted social engineering attacks","It's a technique to trace the source of a malware attack; it helps in threat hunting","It's a technique to trace the history of a document; it helps understand who had access to sensitive data",,,,,,,,,,,,1," Traceroute is a network diagnostic tool used to trace the route that packets take from one destination to another over an IP network. It's useful in the footprinting process to understand the network topology and how traffic flows through a network.","Ethical Hacking, Reconnaissance, Scanning, Enumeration, Vulnerability Analysis"
"Which enumeration technique involves collecting information about DNS records?",multiple-choice,"Zone Transfer","Watering Hole Attack","DNS Exhaustion","SSH Bruteforce",,,,,,,,,,,,1," Zone Transfer is an enumeration technique that involves asking for a DNS server to transfer all of the zone configured for a specific domain.","Ethical Hacking, Reconnaissance, Scanning, Enumeration, Vulnerability Analysis"
"What is the importance of utilizing CVSS in the process of vulnerability analysis?",multiple-choice,"CVSS assigns a severity score to each vulnerability, helping to prioritize remediation efforts.","CVSS helps in password cracking of vulnerable systems.","CVSS is a tool used for launching DoS attacks.","CVSS is used to encrypt data to prevent vulnerabilities.",,,,,,,,,,,,1," CVSS, or Common Vulnerability Scoring System, is used to rate the severity of system vulnerabilities and helps organizations prioritize remediation efforts.","Ethical Hacking, Reconnaissance, Scanning, Enumeration, Vulnerability Analysis"
"Which protocol is primarily used in a UDP scan?",multiple-choice,"TCP","ICMP","HTTP","UDP",,,,,,,,,,,,4," A UDP scan is a type of port scan to check for listening ports in the target host. As its name suggests, it primarily uses the UDP protocol.","Ethical Hacking, Reconnaissance, Scanning, Enumeration, Vulnerability Analysis"
"Which phase of a penetration test focuses on gathering as much information about the target system as possible?",multiple-choice,"Gaining Access","Maintaining Access","Reconnaissance","Analysis",,,,,,,,,,,,3," The Reconnaissance phase of a penetration test involves gathering as much information as possible about the target system before attempting to breach its security.","Ethical Hacking, Reconnaissance, Scanning, Enumeration, Vulnerability Analysis"
"You're a penetration tester tasked with performing an enumeration on a client's network. What information is NOT usually obtained during enumeration?",multiple-choice,"Passwords of the users","Network infrastructure details","Machine names","Usernames of valid users",,,,,,,,,,,,1," While enumeration may provide network infrastructure details, machine names, and usernames, it generally does not include password extraction.","Ethical Hacking, Reconnaissance, Scanning, Enumeration, Vulnerability Analysis"
"What is the primary purpose of a tool like theHarvester in the footprinting and reconnaissance phase?",multiple-choice,"To flood the target's network with traffic","To gain unauthorized access to the target's systems","To gather emails, subdomains, hosts, employee names, open ports, and banners from different public sources","To plant malware on the target's systems",,,,,,,,,,,,3," The theHarvester tool is used for gathering various types of information from different public sources like Google, Bing, LinkedIn, etc. The gathered data can include emails, subdomains, hosts, employee names, open ports, and banners, which can assist in understanding the target's environment and aid in further attack planning.","Ethical Hacking, Reconnaissance, Scanning, Enumeration, Vulnerability Analysis"
"When performing a NetBIOS enumeration, which tool might be used?",multiple-choice,"Ncat","Snmpwalk","net view","Ldapsearch",,,,,,,,,,,,3," net (and its parameter view) is a windows internal tool which can be used to perform various operations, including NetBIOS enumerations.","Ethical Hacking, Reconnaissance, Scanning, Enumeration, Vulnerability Analysis"
"During his reconnaissance phase, ethical hacker George comes across a seemingly abandoned subdomain with an outdated security certificate. Why is this significant for his ethical hacking process?",multiple-choice,"It indicates that the company's network is immune to penetration testing","It shows that the company's IT team is not efficient","It could provide a potential entry point for further investigation","It means that the company's network has already been breached",,,,,,,,,,,,3," Abandoned or neglected parts of a network can often have weaker security measures, making them attractive targets for hackers. An outdated security certificate could indicate that this subdomain has not been maintained, potentially providing a viable entry point for further investigation.","Ethical Hacking, Reconnaissance, Scanning, Enumeration, Vulnerability Analysis"
"During the reconnaissance phase, an ethical hacker finds an employee's resume on a job site, which details specific systems and technologies they've worked with at their current company. How can this information be utilized?",multiple-choice,"To send the employee a phishing email","To determine potential technologies in use that could have known vulnerabilities","To blackmail the employee into providing insider information","To apply for the same job as the employee",,,,,,,,,,,,2," This information can help an ethical hacker understand the technology stack and systems the target company uses. It can be used to identify potential vulnerabilities in these systems that could be exploited in a penetration test.","Ethical Hacking, Reconnaissance, Scanning, Enumeration, Vulnerability Analysis"
"What is the main benefit of using a decoy scan in Nmap?",multiple-choice,"It makes the scanning process faster","It can identify decoy systems in the network","It hides the scanner's IP address among multiple decoy IP addresses","It provides a colorful decoy map of the network",,,,,,,,,,,,3," A decoy scan in Nmap uses spoofed IP addresses along with the real IP address to make it harder to detect where the scanning is actually coming from. The decoys serve as a way to obfuscate the true source of the scan.","Ethical Hacking, Reconnaissance, Scanning, Enumeration, Vulnerability Analysis"
"What is the primary goal of using a Whois lookup in the footprinting process?",multiple-choice,"Identifying web application vulnerabilities","Brute forcing login credentials","Extracting information about domain ownership","Infecting the target's systems with malware",,,,,,,,,,,,3," A Whois lookup is used to extract information about a domain such as the domain owner, its registrar, its creation and expiration dates, and the DNS servers it uses. ","Ethical Hacking, Reconnaissance, Scanning, Enumeration, Vulnerability Analysis"
"What is the primary purpose of a tool like Maltego in the footprinting and reconnaissance phase?",multiple-choice,"To overload the target's network with traffic","To infect the target's systems with malware","To visualize complex networks and relationships between entities","To erase data from the target's systems",,,,,,,,,,,,3," Maltego is an open-source intelligence and forensics application. It's primarily used for data mining and information gathering, as well as the graphical representation of this information. It's particularly useful for illustrating complex networks and relationships between different entities.","Ethical Hacking, Reconnaissance, Scanning, Enumeration, Vulnerability Analysis"
"What method involves tricking individuals into giving out sensitive information, thereby allowing unauthorized access to systems?",multiple-choice,"Password Cracking","Social Engineering","Buffer Overflow","Firewall",,,,,,,,,,,,2," Social engineering manipulates individuals into revealing sensitive information. It preys on human vulnerabilities rather than software and can lead to unauthorized system access.","Ethical Hacking, Reconnaissance, Scanning, Enumeration, Vulnerability Analysis"
"What is the primary benefit of using an ACK scan?",multiple-choice,"Identifying operating systems","Identifying active hosts","Identifying firewall rules","Identifying user activities",,,,,,,,,,,,3," ACK scans are used primarily for mapping out firewall rule sets. They can help to identify which ports are filtered and which are unfiltered.","Ethical Hacking, Reconnaissance, Scanning, Enumeration, Vulnerability Analysis"
"What tool would an ethical hacker use to perform a ping sweep?",multiple-choice,"Nessus","Nmap","Wireshark","Metasploit",,,,,,,,,,,,2," Nmap is a tool that can be used to perform a ping sweep, which is a technique used to identify which hosts are up in a network.","Ethical Hacking, Reconnaissance, Scanning, Enumeration, Vulnerability Analysis"
"What type of information can be obtained through 'Website footprinting' during the reconnaissance phase?",multiple-choice,"Social security numbers of the website's users","Credit card information stored on the website","Information about the website's structure, technology stack, and potentially sensitive directories","Personal emails of the website's users",,,,,,,,,,,,3," Website footprinting can provide information about the website's structure, technology stack, and potentially sensitive directories. Tools like builtwith.com and wappalyzer can help identify the technology stack, and robots.txt or sitemap.xml can reveal important information about the site's structure.","Ethical Hacking, Reconnaissance, Scanning, Enumeration, Vulnerability Analysis"
"During the footprinting phase, ethical hacker Steve identifies several email addresses associated with his target company through data found on the web. How can this information be used?",multiple-choice,"To send spam emails to the company","To create a list of potential targets for a spear-phishing campaign","To pretend to be an employee of the company","To hack into the company's email server",,,,,,,,,,,,2," The identified email addresses could be used to create a list of potential targets for a spear-phishing campaign. Spear-phishing is a targeted form of phishing where the attacker is aware of specific details about their victim, and uses this information to appear more convincing.","Ethical Hacking, Reconnaissance, Scanning, Enumeration, Vulnerability Analysis"
"What is the main purpose of footprinting in the ethical hacking process?",multiple-choice,"Compromising the target's systems","Collecting information about the target","Attacking the target's network","Creating a defensive strategy for the target",,,,,,,,,,,,2," Footprinting is the process of gathering as much information as possible about the target (which could be a person, organization, or system). This aids in understanding the target's security posture and helps in designing a targeted attack strategy.","Ethical Hacking, Reconnaissance, Scanning, Enumeration, Vulnerability Analysis"
"What does a Null session in NetBIOS enumeration provide?",multiple-choice,"A session without data transmission","A session with limited data transmission","A session with unrestricted access to all data","An anonymous session with potential access to certain data",,,,,,,,,,,,4," A Null session in NetBIOS enumeration provides an anonymous logon, which could potentially give access to certain data.","Ethical Hacking, Reconnaissance, Scanning, Enumeration, Vulnerability Analysis"
"In network scanning, what is the purpose of sending a TCP RST packet?",multiple-choice,"To establish a new connection","To close an existing connection","To keep the connection alive","To reset the router",,,,,,,,,,,,2," A TCP RST (reset) packet is sent either in response to an unexpected packet, or when a TCP endpoint needs to abruptly close a connection. ","Ethical Hacking, Reconnaissance, Scanning, Enumeration, Vulnerability Analysis"
"Why are vulnerability assessment tools important for cybersecurity?",multiple-choice,"They provide a complete guarantee against cyber attacks","They can identify, classify, and help remediate vulnerabilities","They can prevent any kind of cyber attack","They replace the need for cybersecurity personnel",,,,,,,,,,,,2," Vulnerability assessment tools are important because they can identify and classify vulnerabilities in a network. The results from these tools can help inform remediation efforts and prioritize vulnerabilities based on their severity.","Ethical Hacking, Reconnaissance, Scanning, Enumeration, Vulnerability Analysis"
"During a network enumeration, you run the command 'net view \\192.168.1.5' and get the following output: - 'ADMIN$ Disk  C:\WINDOWS' - Based on this output, what is the likely operating system of the target machine?",multiple-choice,"Linux","MacOS","Windows","Android",,,,,,,,,,,,3," The presence of an ADMIN$ share that maps to C:\WINDOWS suggests that the target machine is running a version of Windows.","Ethical Hacking, Reconnaissance, Scanning, Enumeration, Vulnerability Analysis"
"You are in the enumeration phase of a network penetration test. Which of the following techniques would likely provide the most valuable information?",multiple-choice,"Denial of service attack","Ping sweep","Malware execution","LDAP Dumping",,,,,,,,,,,,4," Enumerating network services such as LDAP and dumping their information often provides the most valuable information during this phase as it often provides usernames, groups, hostnames which can be crucial for identifying and exploiting potential vulnerabilities.","Ethical Hacking, Reconnaissance, Scanning, Enumeration, Vulnerability Analysis"
"Which of the following is not a popular vulnerability scanner?",multiple-choice,"Nessus","Wireshark","OpenVAS","Nexpose",,,,,,,,,,,,2," Wireshark is a network protocol analyzer, not a vulnerability scanner.","Ethical Hacking, Reconnaissance, Scanning, Enumeration, Vulnerability Analysis"
"In CVSS scoring, what does the 'Temporal Score' measure?",multiple-choice,"The characteristics of a vulnerability that are constant over time and across user environments.","The characteristics of a vulnerability that change over time or in different environments.","The ease of exploitation and the level of privileges needed.","The level of impact on confidentiality, integrity, and availability.",,,,,,,,,,,,2," The 'Temporal Score' in CVSS measures the characteristics of a vulnerability that change over time or in different environments, such as the availability of an exploit, the remediation level, or whether the vulnerability has been confirmed by the vendor.","Ethical Hacking, Reconnaissance, Scanning, Enumeration, Vulnerability Analysis"
"How can an ethical hacker use the social networking site LinkedIn for footprinting a target organization?",multiple-choice,"Extracting sensitive company data from LinkedIn's databases","Gaining unauthorized access to the company's LinkedIn account","Collecting information about the company's employees, their roles, and skills","Launching a denial of service attack against the company's LinkedIn page",,,,,,,,,,,,3," LinkedIn can be a valuable resource for footprinting because it contains information about a company's employees, their roles, skills, and sometimes even their work history. This information can be used to understand a company's structure or to identify potential targets for social engineering attacks.","Ethical Hacking, Reconnaissance, Scanning, Enumeration, Vulnerability Analysis"
"What information does a vulnerability scanner provide?",multiple-choice,"The number of active users in a system.","The contents of a system's databases.","Detailed information about potential vulnerabilities in a system.","Information on how to exploit vulnerabilities.",,,,,,,,,,,,3," A vulnerability scanner is used to identify and report about known vulnerabilities in a system.","Ethical Hacking, Reconnaissance, Scanning, Enumeration, Vulnerability Analysis"
"How do you instruct Nmap to scan for both TCP and UDP ports?",multiple-choice,"nmap -sS -sU target","nmap -st -su target","nmap -p T:U target","nmap -sT:U target",,,,,,,,,,,,1," By using both '-sS' and '-sU' flags in a Nmap command (as in 'nmap -sS -sU target'), Nmap will perform a scan for both TCP (SYN scan) and UDP ports.","Ethical Hacking, Reconnaissance, Scanning, Enumeration, Vulnerability Analysis"
"In the vulnerability audit lifecycle, which step involves evaluating the impact of a known vulnerability?",multiple-choice,"Scanning","Reporting","Identification","Risk Assessment",,,,,,,,,,,,4," The risk assessment phase of the vulnerability audit lifecycle involves evaluating the potential impact of a known vulnerability. This is crucial for prioritizing remediation efforts and resources.","Ethical Hacking, Reconnaissance, Scanning, Enumeration, Vulnerability Analysis"
"What is the Common Vulnerabilities and Exposures (CVE) Identifier used for in vulnerability management?",multiple-choice,"To track and classify system vulnerabilities.","To calculate the impact of a potential exploit.","To provide mitigation techniques for system vulnerabilities.","To demonstrate hacking techniques to trainees.",,,,,,,,,,,,1," The CVE system provides a reference-method for publicly known information-security vulnerabilities and exposures.","Ethical Hacking, Reconnaissance, Scanning, Enumeration, Vulnerability Analysis"
"What type of vulnerability scanner checks for misconfigurations or flaws within a network's equipment, such as routers, switches, and firewalls?",multiple-choice,"Network scanner","Host-based scanner","Wireless scanner","Database scanner",,,,,,,,,,,,1," Network scanners are designed to check for vulnerabilities in network equipment, such as routers, switches, and firewalls.","Ethical Hacking, Reconnaissance, Scanning, Enumeration, Vulnerability Analysis"
"Which law requires organizations to protect EU citizens' personal data and privacy during transactions within EU member states?",multiple-choice,"The Computer Fraud and Abuse Act (CFAA)","The Health Insurance Portability and Accountability Act (HIPAA)","General Data Protection Regulation (GDPR)","Federal Information Security Management Act (FISMA)",,,,,,,,,,,,3," GDPR provides a regulatory framework to ensure the privacy and protection of personal data of EU citizens. It places stringent requirements on how organizations collect, store, and manage personal data.","Ethical Hacking, Reconnaissance, Scanning, Enumeration, Vulnerability Analysis"
"Which framework can be used as a guide for developing an organization's information security program?",multiple-choice,"ISO 27001","HIPAA","PCI DSS","GDPR",,,,,,,,,,,,1," ISO 27001 is a framework for managing information security. It provides guidance on how to manage information security in an organization.","Ethical Hacking, Reconnaissance, Scanning, Enumeration, Vulnerability Analysis"
"What is DNS interrogation, and why is it useful in the footprinting process?",multiple-choice,"It involves extracting data from databases; it's useful to find the target's confidential data","It involves querying DNS records to gather information about a target; it's useful for understanding the target's network structure","It involves decrypting network traffic; it's useful for finding hidden vulnerabilities","It involves observing a user's behavior; it's useful for designing targeted social engineering attacks",,,,,,,,,,,,2," DNS interrogation refers to the process of querying DNS records to gather information about a target's domains, IP addresses, and network structure. It's a key part of the footprinting process.","Ethical Hacking, Reconnaissance, Scanning, Enumeration, Vulnerability Analysis"
"Which network scanning technique can help to identify the services running on a target system?",multiple-choice,"Ping scan","Service detection scan","OS detection scan","Idle scan",,,,,,,,,,,,2," A service detection scan can be used to identify the specific services running on the open ports of a target system. This can help in identifying potential vulnerabilities.","Ethical Hacking, Reconnaissance, Scanning, Enumeration, Vulnerability Analysis"
"After performing a network scan, you identify that a particular server within the network has several open ports. However, nmap is unable to determine which services are running on those ports. What could be a possible reason for this?",multiple-choice,"The services are not currently active","The server is using a firewall that is blocking your scans","The server is running services on non-standard ports","Your scanning tool is malfunctioning",,,,,,,,,,,,3," If you are unable to identify the services running on open ports, it could be because the server is running services on non-standard ports. This can make it harder to identify the services using common port-service mappings.","Ethical Hacking, Reconnaissance, Scanning, Enumeration, Vulnerability Analysis"
"What is the objective of 'social network footprinting' in the reconnaissance phase?",multiple-choice,"To take control of the target's social media accounts","To spam the target's social media accounts with fake news","To gather information about the target from their social media profiles","To delete the target's social media accounts",,,,,,,,,,,,3," Social network footprinting involves analyzing a target's social media profiles to gather information about them. This information can include their location, interests, network of friends or associates, and other personal information which might assist in the ethical hacking process.","Ethical Hacking, Reconnaissance, Scanning, Enumeration, Vulnerability Analysis"
"What type of attack involves sending numerous requests to a network or website in order to overload and incapacitate it?",multiple-choice,"SQL Injection Attack","Cross-Site Scripting Attack","Denial of Service Attack","Man-in-the-Middle Attack",,,,,,,,,,,,3," A Denial of Service (DoS) attack aims to shut down a network or service, causing it to be inaccessible to its intended users by flooding it with excessive requests.","Ethical Hacking, Reconnaissance, Scanning, Enumeration, Vulnerability Analysis"
