"What is Enumeration in the context of Ethical Hacking?",multiple-choice,"The process of identifying live systems on a network","The process of identifying user accounts, groups and shares on a system","The process of identifying security vulnerabilities in a system","The process of physically testing a system",,,,,,,,,,,,2," Enumeration is a process in ethical hacking where the attacker establishes an active connection with the victim and tries to discover as much attack vectors as possible, which often involves identifying user accounts and shared resources. ","Ethical Hacking, Reconnaissance, Scanning, Enumeration, Vulnerability Analysis"
"You've received a vulnerability scan report with a vulnerability tagged as CVE-2023-1234. You're not familiar with this particular CVE. What is your first step?",multiple-choice,"Ignore the vulnerability, it's probably a false positive.","Report the vulnerability to your superior.","Research the vulnerability using the CVE identifier.","Start remediating the vulnerability without further investigation.",,,,,,,,,,,,3," When an unfamiliar vulnerability is identified, the first step should be to research the vulnerability using the provided CVE identifier. This allows you to understand the nature of the vulnerability and the appropriate remediation steps.","Ethical Hacking, Reconnaissance, Scanning, Enumeration, Vulnerability Analysis"
"What is a 'White Hat' hacker's role?",multiple-choice,"A professional who hacks into systems to secure them without permission","A cybersecurity professional who uses their skills to protect systems, with permission from the systems owners","An individual who uses their hacking skills for illegal or malicious purposes","A hobbyist who hacks for fun, with or without permission.",,,,,,,,,,,,2," White Hat hackers, also known as ethical hackers, are cybersecurity experts who use their skills in a lawful manner to secure systems and networks from malicious hackers.","Ethical Hacking, Reconnaissance, Scanning, Enumeration, Vulnerability Analysis"
"Samantha is an ethical hacker who has discovered through social media footprinting that several employees of her target company will be attending a major industry event. How can this information assist in her ethical hacking process?",multiple-choice,"She can attend the event and spread malware","She can use this opportunity to perform a physical attack on the company's premises","She can use the event as a social engineering opportunity to gather more information","She can use the event to launch a denial of service attack on the company's network",,,,,,,,,,,,3," This information could present an opportunity for social engineering. For example, Samantha could potentially interact with employees at the event to gather more information about the company's internal operations or systems.","Ethical Hacking, Reconnaissance, Scanning, Enumeration, Vulnerability Analysis"
"After a vulnerability has been identified and assessed during an audit, what is the next step in the lifecycle?",multiple-choice,"Immediately inform the media about the vulnerability","Ignore the vulnerability and move on to the next one","Remediate the vulnerability","Report the vulnerability to competitors",,,,,,,,,,,,3," After a vulnerability has been identified and assessed, the next step in the vulnerability audit lifecycle is remediation. This involves taking steps to fix the vulnerability or mitigate its potential impact.","Ethical Hacking, Reconnaissance, Scanning, Enumeration, Vulnerability Analysis"
"What is the purpose of the NFS protocol?",multiple-choice,"To allow for the sharing and remote access of files across a network","To provide a secure method of transferring credentials across a network","To route data across the internet","To connect a local network to the internet",,,,,,,,,,,,1," NFS (Network File System) is a protocol that allows for the sharing and remote access of files across a network.","Ethical Hacking, Reconnaissance, Scanning, Enumeration, Vulnerability Analysis"
"What is the primary difference between a vulnerability scan and a penetration test?",multiple-choice,"Vulnerability scans identify potential weaknesses, while penetration tests exploit those weaknesses.","Penetration tests identify potential weaknesses, while vulnerability scans exploit those weaknesses.","Penetration tests are performed by internal teams, while vulnerability scans are performed by external teams.","Vulnerability scans are illegal, while penetration tests are legal.",,,,,,,,,,,,1," While both are important aspects of a comprehensive security strategy, they have different goals. A vulnerability scan identifies potential weaknesses, while a penetration test tries to exploit those weaknesses.","Ethical Hacking, Reconnaissance, Scanning, Enumeration, Vulnerability Analysis"
"What is the first step typically taken in a standard penetration testing procedure?",multiple-choice,"Exploitation","Scanning","Reconnaissance","Gaining Access",,,,,,,,,,,,3," The first step in a typical penetration test is reconnaissance, where the tester gathers information about the target system. This could involve identifying IP addresses, domain details, and more.","Ethical Hacking, Reconnaissance, Scanning, Enumeration, Vulnerability Analysis"
"During an enumeration process, you notice port 389 open on a remote machine. Which protocol is this port typically associated with?",multiple-choice,"Kerberos","DNS","LDAP","FTP",,,,,,,,,,,,3," Port 389 is typically associated with LDAP (Lightweight Directory Access Protocol).","Ethical Hacking, Reconnaissance, Scanning, Enumeration, Vulnerability Analysis"
"What type of reconnaissance involves an attacker directly interacting with a target system?",multiple-choice,"Passive Reconnaissance","Active Reconnaissance","Covert Reconnaissance","Overt Reconnaissance",,,,,,,,,,,,2," Active Reconnaissance involves direct interaction with the target system or network, often by sending packets to the target and analyzing responses to gather information.","Ethical Hacking, Reconnaissance, Scanning, Enumeration, Vulnerability Analysis"
"What is the Nmap command to perform a SYN scan on a specific target?",multiple-choice,"nmap -sS target","nmap -sU target","nmap -sV target","nmap -sT target",,,,,,,,,,,,1," The Nmap command to perform a SYN scan is 'nmap -sS target'. This sends a SYN packet and awaits a SYN-ACK or RST response to determine if the port is open or closed.","Ethical Hacking, Reconnaissance, Scanning, Enumeration, Vulnerability Analysis"
"What is a piece of software that records a user's keystrokes, often used by attackers to gain unauthorized access?",multiple-choice,"Virus","Worm","Trojan","Keylogger",,,,,,,,,,,,4," A keylogger is a type of surveillance technology used to monitor and record each keystroke typed on a specific computer's keyboard. Attackers use this method to gain unauthorized access to sensitive information.","Ethical Hacking, Reconnaissance, Scanning, Enumeration, Vulnerability Analysis"
"Which type of penetration test is performed without prior knowledge of network systems and resources?",multiple-choice,"White Box Testing","Grey Box Testing","Black Box Testing","Red Box Testing",,,,,,,,,,,,3," In Black Box Testing, the tester has no knowledge about the systems to be tested. It is done to simulate an attack from an external source.","Ethical Hacking, Reconnaissance, Scanning, Enumeration, Vulnerability Analysis"
"In vulnerability management, what is the meaning of the term 'Remediation'?",multiple-choice,"Identifying vulnerabilities.","Analyzing the impact of vulnerabilities.","Prioritizing the action on vulnerabilities.","Taking action to eliminate vulnerabilities.",,,,,,,,,,,,4," Remediation in vulnerability management refers to the process of taking action to eliminate or reduce the risk from the identified vulnerabilities.","Ethical Hacking, Reconnaissance, Scanning, Enumeration, Vulnerability Analysis"
"What is one common use of enumeration by ethical hackers?",multiple-choice,"To perform a denial of service attack","To validate user credentials","To extract useful system and network information","To inject malware into a network",,,,,,,,,,,,3," Enumeration is commonly used by ethical hackers to extract valuable information about the system and network, including details about the operating system, usernames, and network infrastructure.","Ethical Hacking, Reconnaissance, Scanning, Enumeration, Vulnerability Analysis"
"What kind of attack involves a hacker disguising themselves as a trusted entity to obtain sensitive information?",multiple-choice,"Phishing Attack","Denial of Service Attack","SQL Injection Attack","Cross-Site Scripting Attack",,,,,,,,,,,,1," Phishing is a type of cyber attack that involves a hacker disguising themselves as a trustworthy entity in order to trick individuals into revealing sensitive information.","Ethical Hacking, Reconnaissance, Scanning, Enumeration, Vulnerability Analysis"
"Which of the following is NOT a benefit of conducting a vulnerability analysis?",multiple-choice,"Identifying vulnerabilities","Prioritizing vulnerabilities","Exploiting vulnerabilities","Mitigating vulnerabilities",,,,,,,,,,,,3," The aim of a vulnerability analysis is to identify, prioritize, and help mitigate vulnerabilities. Exploiting vulnerabilities is not a part of vulnerability analysis.","Ethical Hacking, Reconnaissance, Scanning, Enumeration, Vulnerability Analysis"
"What does 'Job Site Footprinting' refer to during the reconnaissance phase?",multiple-choice,"The process of applying for jobs at the target organization to gain insider information","The process of studying the target organization's job postings to gain insights about the technologies they use, and their operational environment","The process of studying the target organization's employee profiles on job sites to gain insights about their personal information","The process of posting jobs on behalf of the target organization to confuse them",,,,,,,,,,,,2," Job site footprinting involves analyzing an organization's job postings. These can often provide valuable insights about the technologies the organization uses, the nature of projects they are working on, and their operational environment, helping an ethical hacker to understand the potential vulnerabilities.","Ethical Hacking, Reconnaissance, Scanning, Enumeration, Vulnerability Analysis"
"What is the process of tracking, identifying, and organizing digital evidence called?",multiple-choice,"Digital Forensics","Cybersecurity","Ethical Hacking","Cryptography",,,,,,,,,,,,1," Digital Forensics is the process of identifying, preserving, analyzing, and presenting digital evidence in a manner that is legally acceptable.","Ethical Hacking, Reconnaissance, Scanning, Enumeration, Vulnerability Analysis"
"An attacker is reviewing an SMTP server log and encounters the following line: - '220 mail.example.com ESMTP Postfix' - Given this log line, which of the following enumeration methods was likely used by the attacker?",multiple-choice,"The attacker likely used the VRFY command to confirm the existence of a specific email account.","The attacker likely used a Zone Transfer to get the DNS records.","The attacker likely used a banner grabbing technique to identify the SMTP server software.","The attacker likely used a NetBIOS enumeration to get shared resource information.",,,,,,,,,,,,3," The 220 code and following string indicate a server-ready message from the SMTP server, typically displayed at the start of a session. This suggests that the attacker was able to connect to the server and used banner grabbing to identify the server software as Postfix. Other enumeration methods listed, such as using the VRFY command or conducting a Zone Transfer, would not result in this particular log line.","Ethical Hacking, Reconnaissance, Scanning, Enumeration, Vulnerability Analysis"
"What type of scanning technique generates a packet with all flags set?",multiple-choice,"NULL scan","FIN scan","Xmas scan","ACK scan",,,,,,,,,,,,3," An Xmas scan generates a packet with all flags set (FIN, URG, and PUSH). This type of scan can be used to identify listening ports on a host.","Ethical Hacking, Reconnaissance, Scanning, Enumeration, Vulnerability Analysis"
"Which scan can be used to determine if a host is alive but does not guarantee the identification of open or filtered ports?",multiple-choice,"Ping scan","UDP scan","Xmas scan","SYN scan",,,,,,,,,,,,1," A Ping scan, also known as an ICMP echo request, is typically used to find end hosts that are alive on a network. However, it doesn't provide information about specific open ports on those hosts.","Ethical Hacking, Reconnaissance, Scanning, Enumeration, Vulnerability Analysis"
"What is the purpose of a vulnerability assessment in cybersecurity?",multiple-choice,"To identify, quantify, and prioritize vulnerabilities in a system.","To perform penetration testing and exploit system vulnerabilities.","To provide the necessary infrastructure for network communication.","To hack into a system and steal information.",,,,,,,,,,,,1," The primary purpose of a vulnerability assessment is to identify, quantify, and prioritize (or rank) vulnerabilities in a system.","Ethical Hacking, Reconnaissance, Scanning, Enumeration, Vulnerability Analysis"
"In network scanning, what is the purpose of the '-Pn' option in Nmap?",multiple-choice,"To perform a ping scan","To disable host detection and assume the host is up","To perform a port scan","To prioritize scanning on higher-numbered ports",,,,,,,,,,,,2," In Nmap, the '-Pn' option is used to disable the initial ping scan that checks if the host is up. This can be useful if ICMP is blocked but other services are available.","Ethical Hacking, Reconnaissance, Scanning, Enumeration, Vulnerability Analysis"
"What does the Idle scan (also known as a Zombie scan) use to conceal the hacker's IP?",multiple-choice,"The IP address of another host","VPN","Tor network","Proxies",,,,,,,,,,,,1," In an Idle scan, the attacker uses spoofed IP packets from a zombie host (an idle third-party host) to probe another host. This effectively hides the attacker's IP.","Ethical Hacking, Reconnaissance, Scanning, Enumeration, Vulnerability Analysis"
"During an enumeration process, which port is generally associated with the FTP service?",multiple-choice,"22","80","161","21",,,,,,,,,,,,4," FTP typically operates on port 21.","Ethical Hacking, Reconnaissance, Scanning, Enumeration, Vulnerability Analysis"
"During a vulnerability analysis, you find that your company's server is running an out-of-date version of Apache with several known vulnerabilities. What should be your course of action?",multiple-choice,"Continue running the current version of Apache.","Update Apache to the latest version.","Switch to a different server software.","Disable Apache completely.",,,,,,,,,,,,2," Keeping software up to date is one of the key strategies in managing vulnerabilities, as many updates contain patches for known vulnerabilities.","Ethical Hacking, Reconnaissance, Scanning, Enumeration, Vulnerability Analysis"
"Which of the following services typically operates on port 443?",multiple-choice,"HTTP","SNMP","HTTPS","POP3",,,,,,,,,,,,3," HTTPS operates on port 443.","Ethical Hacking, Reconnaissance, Scanning, Enumeration, Vulnerability Analysis"
"What type of footprinting is performed using 'robots.txt' during the reconnaissance phase?",multiple-choice,"Website Footprinting","Email Footprinting","Social Network Footprinting","Network Footprinting",,,,,,,,,,,,1," Robots.txt is a file that web administrators use to instruct web robots (usually search engine robots) about how to interact with their website. It can often reveal hidden or low-profile parts of a website, making it an effective tool for website footprinting during the reconnaissance phase.","Ethical Hacking, Reconnaissance, Scanning, Enumeration, Vulnerability Analysis"
"What does the Payment Card Industry Data Security Standard (PCI DSS) aim to safeguard?",multiple-choice,"Government secrets","Personal health information","Passwords for online accounts","Credit card information",,,,,,,,,,,,4," PCI DSS is a set of security standards designed to ensure all companies that accept, process, store, or transmit credit card information maintain a secure environment.","Ethical Hacking, Reconnaissance, Scanning, Enumeration, Vulnerability Analysis"
"What is the purpose of the SNMP protocol?",multiple-choice,"To manage devices on IP networks","To securely transfer files over a network","To translate domain names to IP addresses","To connect a local network to the internet",,,,,,,,,,,,1," SNMP (Simple Network Management Protocol) is used for managing various devices' configurations on TCP/IP networks.","Ethical Hacking, Reconnaissance, Scanning, Enumeration, Vulnerability Analysis"
"Which scan type can help an attacker identify an operating system?",multiple-choice,"ACK scan","OS detection scan","Xmas scan","FIN scan",,,,,,,,,,,,2," OS detection scan is used to identify the operating system of a target host. Knowledge of the operating system can aid an attacker in tailoring their exploits.","Ethical Hacking, Reconnaissance, Scanning, Enumeration, Vulnerability Analysis"
"What is the primary objective of ethical hacking?",multiple-choice,"To exploit network vulnerabilities for personal gain","To identify and fix network vulnerabilities before malicious hackers can exploit them","To disrupt network services for fun","To illegally access confidential information",,,,,,,,,,,,2," Ethical hacking aims to discover and fix vulnerabilities in systems and networks, effectively beating malicious hackers at their own game. They do this with permission and without any intention of causing harm.","Ethical Hacking, Reconnaissance, Scanning, Enumeration, Vulnerability Analysis"
"What is 'email footprinting', and why is it useful in the reconnaissance phase?",multiple-choice,"It involves stealing a user's email login credentials; it's useful for gaining unauthorized access to the user's emails","It involves sending spam emails to a target; it's useful for overwhelming the target's email server","It involves gathering information through emails or email systems; it's useful for understanding the target's communication structure","It involves infecting the target's email server with malware; it's useful for compromising the target's network",,,,,,,,,,,,3," Email footprinting involves gathering information through emails or email systems, such as understanding the email address structure of an organization, which can provide information on the organization's communication structure and potential targets for phishing attacks.","Ethical Hacking, Reconnaissance, Scanning, Enumeration, Vulnerability Analysis"
"An attacker successfully performs an SNMP enumeration on a target and identifies 'public' as a community string. What does this finding signify?",multiple-choice,"The target is using default SNMP community string settings.","The target has an open port 80.","The target is using secure SNMP settings.","The target has disabled SNMP.",,,,,,,,,,,,1," SNMP has two community strings, 'public' and 'private', that are used as passwords and they are set to these defaults in many devices. If the community string is still set to 'public', it may indicate a lack of proper security configuration.","Ethical Hacking, Reconnaissance, Scanning, Enumeration, Vulnerability Analysis"
"If an attacker is performing SNMP enumeration, which port should they focus on?",multiple-choice,"22","80","161","21",,,,,,,,,,,,3," SNMP (Simple Network Management Protocol) typically uses the port 161 and 162.","Ethical Hacking, Reconnaissance, Scanning, Enumeration, Vulnerability Analysis"

