"What is the primary purpose of a port scan in the context of ethical hacking?",multiple-choice,"To determine active services and their corresponding ports on a target system","To establish a secure connection with a remote server","To perform a DDoS attack on a network","To spoof the IP address of the attacker",,,,,,,,,,,,1," In the context of ethical hacking, a port scan is typically used to identify open ports and active services on a target system. This information can help identify potential vulnerabilities that may be exploited in a penetration test.","Ethical Hacking, Reconnaissance, Scanning, Enumeration, Vulnerability Analysis"
"John is an ethical hacker who has been hired to perform a penetration test on a company's network. During the footprinting phase, he discovers an active, but publicly unknown, subdomain. What could this mean for his penetration test?",multiple-choice,"It could provide a potential entry point for further investigation","It means the company's network is secure and immune to penetration testing","It indicates that the company's network is about to fail","It shows that John has already breached the company's network",,,,,,,,,,,,1," Discovery of an active, yet publicly unknown, subdomain might indicate areas of the network that are not well monitored or protected, potentially providing a viable entry point for further investigation during the penetration test.","Ethical Hacking, Reconnaissance, Scanning, Enumeration, Vulnerability Analysis"
"Why might an attacker choose to use a UDP scan over a TCP scan?",multiple-choice,"UDP scans are faster","UDP scans can identify services that TCP scans cannot","UDP scans are always stealthier than TCP scans","UDP scans are easier to perform",,,,,,,,,,,,2," UDP scans are used to identify UDP services running on a target's open ports. Some services use UDP instead of TCP, so a UDP scan can identify services that a TCP scan cannot.","Ethical Hacking, Reconnaissance, Scanning, Enumeration, Vulnerability Analysis"
"What is the role of OSINT (Open Source Intelligence) in the reconnaissance phase of ethical hacking?",multiple-choice,"It involves exploiting system vulnerabilities to gain unauthorized access","It refers to using proprietary tools to scan a network for weaknesses","It involves gathering freely available information from public sources to learn more about the target","It involves using social engineering techniques to manipulate individuals into revealing confidential information",,,,,,,,,,,,3," In the context of reconnaissance, OSINT  refers to gathering information from publicly available sources to gain insight into potential targets. This can include a wide range of data, such as domain registration details, public records, social media posts, and more.","Ethical Hacking, Reconnaissance, Scanning, Enumeration, Vulnerability Analysis"
"What standard procedure ensures the ongoing operation during a system failure?",multiple-choice,"Intrusion Detection System (IDS)","Firewall","Business Continuity Plan (BCP)","Least Privilege",,,,,,,,,,,,3," A Business Continuity Plan (BCP) is a plan for how to handle outages to IT systems, applications and data access in order to maintain business operations.","Ethical Hacking, Reconnaissance, Scanning, Enumeration, Vulnerability Analysis"
"What does a higher CVSS score indicate?",multiple-choice,"The vulnerability is easy to exploit","The vulnerability is difficult to exploit","The vulnerability has a greater severity","The vulnerability has a lower severity",,,,,,,,,,,,3," The CVSS score, ranging from 0 to 10, is a measurement of the severity of a vulnerability. A higher score indicates a greater severity.","Ethical Hacking, Reconnaissance, Scanning, Enumeration, Vulnerability Analysis"
"During enumeration, what information can be obtained by a successful Zone Transfer?",multiple-choice,"Network traffic information","Login credentials","Detailed information about all the DNS records","Encrypted data",,,,,,,,,,,,3," Zone Transfer allows the attacker to access the DNS records, revealing detailed information about hosts, servers, and other network details.","Ethical Hacking, Reconnaissance, Scanning, Enumeration, Vulnerability Analysis"
"Which of the following tools can be used for DNS enumeration during a reconnaissance process?",multiple-choice,"Nmap","Wireshark","TrueCrypt","SpiderFoot",,,,,,,,,,,,1," Nmap, short for Network Mapper, is a versatile tool used for network discovery and security auditing, including DNS enumeration, where the attacker extracts domain names, computer names, and IP addresses from a DNS server.","Ethical Hacking, Reconnaissance, Scanning, Enumeration, Vulnerability Analysis"
"What is a 'Half-Open' scanning technique in the context of network scanning?",multiple-choice,"A scanning technique where the scanner attempts to open half of the available ports on the target","A scanning technique where the three-way TCP handshake is not completed","A scanning technique used in the middle of the night","A scanning technique that only identifies half of the vulnerabilities",,,,,,,,,,,,2," In the context of network scanning, a 'Half-Open' scanning technique refers to a process where the three-way TCP handshake is not completed. The SYN flag is sent, but when the target responds with a SYN-ACK, the scanner responds with a RST packet instead of an ACK packet, hence the connection is not fully established.","Ethical Hacking, Reconnaissance, Scanning, Enumeration, Vulnerability Analysis"
"An nmap scan has been performed and the following output has been produced: '22/tcp open  ssh'. What does this output mean?",multiple-choice,"The system's SSH service is closed on port 22.","The system's SSH service is open on port 22.","The system's FTP service is open on port 22.","The system's SSH service is open on port 22 but is currently inactive.",,,,,,,,,,,,2," Nmap's output '22/tcp open ssh' signifies that the system's SSH service is open and running on port 22.","Ethical Hacking, Reconnaissance, Scanning, Enumeration, Vulnerability Analysis"
"What is the primary use of the hping3 tool in network scanning?",multiple-choice,"To create custom TCP/IP packets for testing network systems","To hide IP addresses during scanning","To encrypt network traffic","To predict network traffic patterns",,,,,,,,,,,,1," hping3 is a network tool that allows you to craft custom TCP/IP packets, allowing detailed and flexible testing of firewalls, networks, and systems.","Ethical Hacking, Reconnaissance, Scanning, Enumeration, Vulnerability Analysis"
"What kind of information can be obtained from the HTTP headers of a web server during the reconnaissance phase?",multiple-choice,"Social security numbers of the server administrators","Credit card numbers stored on the server","Details about the server, such as the server software and version","The company's financial information",,,,,,,,,,,,3," HTTP headers can provide information about the web server, including the type of server software being used and the version number. This information can be used to look for known vulnerabilities associated with that specific server software and version.","Ethical Hacking, Reconnaissance, Scanning, Enumeration, Vulnerability Analysis"
"What is the main difference between a vulnerability assessment and penetration testing?",multiple-choice,"A vulnerability assessment looks for potential vulnerabilities, while penetration testing tries to exploit them","A vulnerability assessment exploits system vulnerabilities, while penetration testing only identifies them","A vulnerability assessment and penetration testing are exactly the same","A vulnerability assessment is a legal process, while penetration testing is not",,,,,,,,,,,,1," While both vulnerability assessments and penetration testing aim to identify vulnerabilities, a vulnerability assessment focuses on uncovering vulnerabilities, while penetration testing takes it a step further by trying to exploit the vulnerabilities.","Ethical Hacking, Reconnaissance, Scanning, Enumeration, Vulnerability Analysis"
"What is the primary function of a CVE Identifier in the realm of cybersecurity?",multiple-choice,"To perform network intrusion detection.","To provide a method for identifying vulnerabilities and exposures in a publicly known manner.","To conduct penetration testing on a target network.","To monitor network traffic for malicious activity.",,,,,,,,,,,,2," A CVE Identifier provides a standardized method for identifying vulnerabilities and exposures in a publicly known manner.","Ethical Hacking, Reconnaissance, Scanning, Enumeration, Vulnerability Analysis"
"You have conducted a vulnerability scan on your company's network and found a number of vulnerabilities with different CVSS scores. Which vulnerability should be addressed first?",multiple-choice,"Vulnerability A with CVSS score 4.0","Vulnerability B with CVSS score 8.0","Vulnerability C with CVSS score 2.0","Vulnerability D with CVSS score 6.0",,,,,,,,,,,,2," Vulnerabilities with higher CVSS scores represent a higher severity and should be addressed first.","Ethical Hacking, Reconnaissance, Scanning, Enumeration, Vulnerability Analysis"
"Your organization has received numerous alerts about potential scan attacks on your network. What immediate action should you take to verify these alerts?",multiple-choice,"Shut down the entire network","Check the log files of your IDS/IPS","Update all user passwords","Unplug all network cables",,,,,,,,,,,,2," The immediate step should be to verify these alerts by checking the log files of your Intrusion Detection System/Intrusion Prevention System (IDS/IPS). They contain detailed information about network activities.","Ethical Hacking, Reconnaissance, Scanning, Enumeration, Vulnerability Analysis"
"Why might an attacker use a slow scan instead of a fast scan?",multiple-choice,"To avoid triggering security mechanisms","Because they have a slow internet connection","Because it's easier to perform","To test the patience of their victim",,,,,,,,,,,,1," Slow scans (or low-and-slow scans) take longer, but they are more likely to avoid detection by security mechanisms that look for multiple requests in a short time span.","Ethical Hacking, Reconnaissance, Scanning, Enumeration, Vulnerability Analysis"
"What is a 'ping sweep', and why is it used during the reconnaissance phase?",multiple-choice,"It's a technique to determine live hosts in a network range; it's used to understand the target's network topology","It's a technique to overload a network with traffic; it's used to test the target's network resilience","It's a technique to disrupt network services; it's used to assess the impact of a denial of service attack","It's a technique to measure network latency; it's used to optimize the target's network performance",,,,,,,,,,,,1," A ping sweep is a network scanning method used to determine which of a range of IP addresses map to live hosts (computers). This is typically used to understand the network topology and discover live hosts during the reconnaissance phase.","Ethical Hacking, Reconnaissance, Scanning, Enumeration, Vulnerability Analysis"
"What is the BGP protocol used for?",multiple-choice,"Routing data across the internet","Encrypting data for secure transmission over a network","Transferring files between networked devices","Translating URLs into IP addresses",,,,,,,,,,,,1," BGP (Border Gateway Protocol) is used for routing data across the internet by determining the best path for data transfer.","Ethical Hacking, Reconnaissance, Scanning, Enumeration, Vulnerability Analysis"
"Which type of vulnerability scanner is designed specifically to identify vulnerabilities in web applications, such as SQL injection and cross-site scripting vulnerabilities?",multiple-choice,"Network scanner","Host-based scanner","Database scanner","Web application scanner",,,,,,,,,,,,4," Web application scanners are designed specifically to identify vulnerabilities in web applications, such as SQL injection and cross-site scripting vulnerabilities.","Ethical Hacking, Reconnaissance, Scanning, Enumeration, Vulnerability Analysis"
"What Nmap command would be used to detect the operating system of a target?",multiple-choice,"nmap -O target","nmap -sV target","nmap -oS target","nmap -oN target",,,,,,,,,,,,1," The Nmap command for OS detection is 'nmap -O target'. This utilizes TCP/IP stack fingerprinting to guess the operating system of the target.","Ethical Hacking, Reconnaissance, Scanning, Enumeration, Vulnerability Analysis"
"Which network scanning technique does not complete the three-way handshake and is therefore often referred to as 'stealth scanning'?",multiple-choice,"SYN Scan","Connect Scan","UDP Scan","Xmas Scan",,,,,,,,,,,,1," SYN scanning, often referred to as 'half-open scanning,' is a tactic that a hacker can use to prevent their scanning attempts from being detected by firewall systems. The three-way handshake is not completed, thus it is also known as 'stealth scanning.'","Ethical Hacking, Reconnaissance, Scanning, Enumeration, Vulnerability Analysis"
"Which law requires public companies in the United States to demonstrate control over their financial reporting?",multiple-choice,"HIPAA","GDPR","PCI DSS","Sarbanes-Oxley Act",,,,,,,,,,,,4," The Sarbanes-Oxley Act (SOX) of 2002 is a US law that requires public companies to demonstrate control over their financial reporting.","Ethical Hacking, Reconnaissance, Scanning, Enumeration, Vulnerability Analysis"
"Which of these tools is NOT primarily used for network scanning?",multiple-choice,"Nmap","hping3","Zenmap","TrueCrypt",,,,,,,,,,,,4," TrueCrypt is primarily used for disk encryption and creating virtual encrypted disks in a file. While Nmap and Nessus are network scanning tools, Wireshark is used for network packet analysis.","Ethical Hacking, Reconnaissance, Scanning, Enumeration, Vulnerability Analysis"
"What's the term used for the practice of managing and controlling vulnerabilities in a computer system or network?",multiple-choice,"Threat modeling","Vulnerability Management","Intrusion Detection","Risk Management",,,,,,,,,,,,2," Vulnerability Management is the cyclical practice of identifying, classifying, prioritizing, remediating, and mitigating vulnerabilities.","Ethical Hacking, Reconnaissance, Scanning, Enumeration, Vulnerability Analysis"
"What is the goal of penetration testing?",multiple-choice,"To discover vulnerabilities in a system before an attacker does","To damage systems for personal gain","To overload a system and shut it down","To steal sensitive data from a system",,,,,,,,,,,,1," Penetration testing simulates a cyber attack against your computer system to check for exploitable vulnerabilities. It helps organizations discover weaknesses before a malicious actor does.","Ethical Hacking, Reconnaissance, Scanning, Enumeration, Vulnerability Analysis"
"Which type of penetration testing relies on having full knowledge about the target system?",multiple-choice,"White Box Testing","Black Box Testing","Grey Box Testing","Red Team Testing",,,,,,,,,,,,1," In White Box Testing, the tester has full knowledge of the system being tested. This method often provides a more thorough examination of the system's security.","Ethical Hacking, Reconnaissance, Scanning, Enumeration, Vulnerability Analysis"
"You are analyzing network traffic and notice several packets with the URG, PSH, and FIN flags set. What type of scan might this indicate?",multiple-choice,"Connect Scan","Xmas Scan","SYN Scan","ACK Scan",,,,,,,,,,,,2," An Xmas scan is a type of advanced network scan where the scanner sets the URG, PSH, and FIN flags, hoping to confuse or bypass firewalls or intrusion detection systems.","Ethical Hacking, Reconnaissance, Scanning, Enumeration, Vulnerability Analysis"
"What is the primary purpose of a port scan?",multiple-choice,"To map out the network's system resources for vulnerabilities","To breach the system's security","To perform a denial-of-service (DoS) attack","To disconnect users from a network",,,,,,,,,,,,1," Port scanning is used to identify open ports and services available on a host network. It's a crucial step for mapping out system resources and identifying potential vulnerabilities.","Ethical Hacking, Reconnaissance, Scanning, Enumeration, Vulnerability Analysis"
"Why might an ethical hacker use a tool like Maltego in the footprinting process?",multiple-choice,"To infect the target's systems with malware","To gain unauthorized access to the target's systems","To visualize complex networks and relationships between entities","To simulate a denial of service attack on the target's network",,,,,,,,,,,,3," Maltego is a data visualization tool used for link analysis and data mining. It can be used to visualize complex networks and identify relationships and links between entities, making it useful for footprinting and reconnaissance.","Ethical Hacking, Reconnaissance, Scanning, Enumeration, Vulnerability Analysis"
"What does the term 'Zero Day' refer to in the context of information security?",multiple-choice,"The day an IT system goes online","A vulnerability that is unknown to those who should be interested in its mitigation (software vendor, etc.) until it's exploited","The day a security patch is released","The first day of a cyber attack",,,,,,,,,,,,2," A 'Zero Day' or 'Zero-Day Vulnerability' refers to a software security flaw that is unknown to the software vendor and has no patches or fixes. It's called 'Zero Day' because developers find out about the vulnerability the same day that it's exploited.","Ethical Hacking, Reconnaissance, Scanning, Enumeration, Vulnerability Analysis"
"Why should an ethical hacker understand and adhere to the Health Insurance Portability and Accountability Act (HIPAA)?",multiple-choice,"Because HIPAA outlines the ethical guidelines that all hackers should follow","Because understanding HIPAA can help a hacker infiltrate healthcare systems more effectively","Because ethical hackers may work with healthcare data and must ensure its confidentiality, integrity, and availability","Because HIPAA provides the legal framework for all computer security investigations",,,,,,,,,,,,3," HIPAA includes provisions to protect electronic health data. If ethical hackers work with healthcare organizations, they need to ensure that their practices are in compliance with HIPAA to maintain data security and privacy.","Ethical Hacking, Reconnaissance, Scanning, Enumeration, Vulnerability Analysis"
"You are an ethical hacker who has been hired to perform a network scan on a corporate network. The corporation's security team is aware of your activities and is observing network traffic. Which scanning technique can you use to confuse the security team's log analysis?",multiple-choice,"Connect Scan","Null Scan","Decoy Scan","FIN Scan",,,,,,,,,,,,3," Decoy scanning involves spoofing the IP address of the scanning machine with other IP addresses. This can make it difficult for network administrators to determine the real source of the scan.","Ethical Hacking, Reconnaissance, Scanning, Enumeration, Vulnerability Analysis"
"What can be inferred from a successful ICMP Echo Request during the footprinting phase?",multiple-choice,"The target's system is infected with malware","The target's system is live and reachable","The target's system has a certain vulnerability","The target's system is offline or unreachable",,,,,,,,,,,,2," ICMP Echo Request, often known as a 'ping', is a basic Internet protocol message sent from one computer to another to check if the other computer is reachable. If the echo request is successful, it indicates that the target's system is live and reachable.","Ethical Hacking, Reconnaissance, Scanning, Enumeration, Vulnerability Analysis"
"Which vulnerability scanner is used to identify vulnerabilities, insecure settings, and open ports within a specific host machine?",multiple-choice,"Wireless scanner","Network scanner","Host-based scanner","Web application scanner",,,,,,,,,,,,3," Host-based scanners are designed to identify vulnerabilities within a specific host machine, such as open ports and insecure settings.","Ethical Hacking, Reconnaissance, Scanning, Enumeration, Vulnerability Analysis"
"Which of the following terms best describes a hole in a software system that hackers can exploit?",multiple-choice,"Sniffer","Vulnerability","Firewall","Spyware",,,,,,,,,,,,2," A vulnerability refers to a hole or a weakness in the application, which can be a design flaw or an implementation bug, that allows an attacker to cause harm to the stakeholders of an application.","Ethical Hacking, Reconnaissance, Scanning, Enumeration, Vulnerability Analysis"
"What common protocol can be used to enumerate details about devices on a network?",multiple-choice,"ICMP","SNMP","POP","DNS",,,,,,,,,,,,2," Simple Network Management Protocol (SNMP) is commonly used to manage and monitor network devices and can be used to gather information from these devices.","Ethical Hacking, Reconnaissance, Scanning, Enumeration, Vulnerability Analysis"
"Which protocol does enumeration often target?",multiple-choice,"HTTP","FTP","DNS","SMB",,,,,,,,,,,,4," SMB (Server Message Block) is a commonly targeted protocol in enumeration because it's used for sharing access to files, printers, serial ports, and other resources on a network.","Ethical Hacking, Reconnaissance, Scanning, Enumeration, Vulnerability Analysis"
"What kind of information can be obtained from banner grabbing during the reconnaissance phase?",multiple-choice,"Social security numbers of employees","Confidential company documents","Specifics about network services and versions","Credit card numbers of customers",,,,,,,,,,,,3," Banner grabbing is a technique used to gain information about a computer system on a network, and can be used to identify network hosts running specific services and the version numbers of those services.","Ethical Hacking, Reconnaissance, Scanning, Enumeration, Vulnerability Analysis"
"You are an ethical hacker hired to test the network security of a corporation. What is the first type of scan you might perform to get an overview of responsive hosts on the network?",multiple-choice,"Ping Scan","OS Detection Scan","SYN Scan","ACK Scan",,,,,,,,,,,,1," As an ethical hacker, you would typically perform a Ping Scan first to identify which hosts are up on a network.","Ethical Hacking, Reconnaissance, Scanning, Enumeration, Vulnerability Analysis"
"Which of the following vulnerability scanners is a free open-source tool?",multiple-choice,"Nessus","Qualys","Nexpose","OpenVAS",,,,,,,,,,,,4," OpenVAS (Open Vulnerability Assessment System) is a free open-source vulnerability scanner.","Ethical Hacking, Reconnaissance, Scanning, Enumeration, Vulnerability Analysis"
"In the context of information security, what does the CIA triad stand for?",multiple-choice,"Confidentiality, Integrity, Availability","Central Intelligence Agency","Coding, Integrity, Authentication","Confidentiality, Identification, Availability",,,,,,,,,,,,1," In information security, the CIA triad stands for Confidentiality (keeping information secret from unauthorized users), Integrity (ensuring the accuracy and completeness of data), and Availability (ensuring that the information is accessible to authorized users when needed).","Ethical Hacking, Reconnaissance, Scanning, Enumeration, Vulnerability Analysis"
"What kind of tool is 'SpiderFoot', and why is it used in the footprinting process?",multiple-choice,"It's a password cracking tool; it's used to gain unauthorized access to the target's systems","It's a malware analysis tool; it's used to understand the malware threats facing the target","It's a reconnaissance tool; it's used to automatically gather and analyze information about a target","It's a network traffic analysis tool; it's used to understand the target's network traffic patterns",,,,,,,,,,,,3," SpiderFoot is an open-source intelligence (OSINT) automation tool. It integrates with various data sources to gather and analyze information about a target, making it useful for automating the footprinting process.","Ethical Hacking, Reconnaissance, Scanning, Enumeration, Vulnerability Analysis"
"Which tool mainly manages, analyzes, and collects security logs in an IT environment?",multiple-choice,"Network Intrusion Detection System (NIDS)","Security Information and Event Management (SIEM)","Firewall","Rootkit",,,,,,,,,,,,2," SIEM is a software solution that aggregates and analyzes activity from various resources across your IT infrastructure. It provides real-time analysis of security alerts generated by applications and network hardware","Ethical Hacking, Reconnaissance, Scanning, Enumeration, Vulnerability Analysis"
"What is one major advantage of using Nmap for scanning?",multiple-choice,"It is always undetectable by firewalls","It automatically hacks into detected systems","It offers a comprehensive set of features for network mapping and security auditing","It provides the attacker's location",,,,,,,,,,,,3," Nmap is a popular tool for network scanning because it offers a comprehensive set of features for network mapping and security auditing, including various types of scans, OS detection, and more.","Ethical Hacking, Reconnaissance, Scanning, Enumeration, Vulnerability Analysis"
